{
    "id": "example-get-num-pages-from-embedded-pdf",
    "name": "Get Num Pages From Embedded PDF",
    "description": "Example channel: Get Num Pages From Embedded PDF.",
    "type": "channel",
    "publisher": "NextGen Healthcare",
    "repository": "https://github.com/gibson9583/connect-examples",
    "homepage": "https://github.com/gibson9583/connect-examples",
    "documentation": "https://github.com/gibson9583/connect-examples/blob/master/Channels/Get%20Num%20Pages%20From%20Embedded%20PDF/README.md",
    "license": "MPL-2.0",
    "authors": [
        "Nick Rupley"
    ],
    "keywords": [
        "example",
        "channel"
    ],
    "deprecated": false,
    "contentId": "6de4dab6-cbb8-4840-87bb-31a85fab9101"
}
