{
    "id": "ct-join-hl7-subcomponents",
    "name": "Join HL7 Subcomponents",
    "description": "Example code template: Join HL7 Subcomponents.",
    "type": "code-template",
    "publisher": "NextGen Healthcare",
    "repository": "https://github.com/gibson9583/connect-examples",
    "homepage": "https://github.com/gibson9583/connect-examples",
    "documentation": "https://github.com/gibson9583/connect-examples/blob/master/Code%20Templates/Join%20HL7%20Subcomponents/README.md",
    "license": "MPL-2.0",
    "authors": [
        "Tony Germano"
    ],
    "keywords": [
        "example",
        "code template"
    ],
    "deprecated": false,
    "contentId": "aab23d47-cae1-4a03-9317-27246e5cf808"
}
