{
    "id": "ct-replace-in-all-descendant-xml-nodes",
    "name": "Replace in All Descendant XML Nodes",
    "description": "Example code template: Replace in All Descendant XML Nodes.",
    "type": "code-template",
    "publisher": "NextGen Healthcare",
    "repository": "https://github.com/gibson9583/connect-examples",
    "homepage": "https://github.com/gibson9583/connect-examples",
    "documentation": "https://github.com/gibson9583/connect-examples/blob/master/Code%20Templates/Replace%20in%20All%20Descendant%20XML%20Nodes/README.md",
    "license": "MPL-2.0",
    "authors": [
        "Nick Rupley"
    ],
    "keywords": [
        "example",
        "code template"
    ],
    "deprecated": false,
    "contentId": "c4ef99be-6845-4167-8a07-1e6c40b52bb3"
}
