{
    "id": "ct-count-segments",
    "name": "Count Segments",
    "description": "Counts the segments with a given name (e.g. OBX) in an HL7 v2.x message. Published as a raw .js file.",
    "type": "code-template",
    "publisher": "NextGen Healthcare",
    "repository": "https://github.com/gibson9583/connect-examples",
    "homepage": "https://github.com/gibson9583/connect-examples",
    "documentation": "https://github.com/gibson9583/connect-examples/blob/master/Code%20Templates/Count%20Segments/README.md",
    "license": "MPL-2.0",
    "authors": [
        "Chris Gibson"
    ],
    "keywords": [
        "example",
        "code template",
        "javascript"
    ],
    "deprecated": false,
    "contentId": "e3fd13f1-94ab-329b-b4ef-fa95d350efbe"
}