{
    "id": "totpmfa",
    "name": "TOTP MFA",
    "description": "TOTP (RFC 6238) multi-factor authentication for administrator login. Users self-enroll on first login (QR / key + code); every login after asks for the current code. Per-user secrets are stored encrypted in the engine database (MyBatis) with single-use challenges, transactional replay protection, and persistent attempt limits. Includes a Settings tab to reset a user for lost-device recovery.",
    "type": "plugin",
    "publisher": "Chris Gibson",
    "repository": "https://github.com/gibson9583/oie-totp-plugin",
    "homepage": "https://github.com/gibson9583/oie-totp-plugin",
    "documentation": "https://github.com/gibson9583/oie-totp-plugin#readme",
    "license": "MPL-2.0",
    "authors": [
        "Chris Gibson"
    ],
    "keywords": [
        "mfa",
        "2fa",
        "totp",
        "authentication",
        "security",
        "login"
    ],
    "deprecated": false
}
